{
  "_meta": {
    "description": "What the admission checklist cannot derive from the other data: the original patterns, the waivers of their known gaps, declarations about a pattern, and recorded sources and red-flag boundaries (library-expansion design §4). Build-time only.",
    "schema": 1,
    "waivers": 5
  },
  "margin_exceptions": [
    {
      "patterns": [
        "HT2",
        "KD1"
      ],
      "reason": "Disharmony between heart and kidney is kidney yin deficiency with heart fire, so the two typical patients share most of the picture. K-07 requires, and the question-bank test checks, that at least three questions separate them; the clinical reviewer decides whether the weights should move them further apart."
    }
  ],
  "needs_exam": [
    "EX3",
    "HT2",
    "KD1",
    "SP6"
  ],
  "no_release_formula": [
    {
      "pattern": "EX1",
      "reason": "All of its formulas are tier C (computed from the herbs: a strong herb, a high bitter-cold share, or a formula outside the first set), which a release does not show. A release shows its diet, points and lifestyle and the result page says so; whether another formula should serve it is the pharmacy and clinical reviewers' decision (design §8)."
    },
    {
      "pattern": "LV1",
      "reason": "All of its formulas are tier B (computed from the herbs: a high blood-activating share or an interaction flag), which a release does not show. A release shows its diet, points and lifestyle and the result page says so; whether another formula should serve it is the pharmacy and clinical reviewers' decision (design §8)."
    },
    {
      "pattern": "LV2",
      "reason": "All of its formulas are tier C (computed from the herbs: a strong herb, a high bitter-cold share, or a formula outside the first set), which a release does not show. A release shows its diet, points and lifestyle and the result page says so; whether another formula should serve it is the pharmacy and clinical reviewers' decision (design §8)."
    },
    {
      "pattern": "LV4",
      "reason": "All of its formulas are tier B (computed from the herbs: a high blood-activating share or an interaction flag), which a release does not show. A release shows its diet, points and lifestyle and the result page says so; whether another formula should serve it is the pharmacy and clinical reviewers' decision (design §8)."
    },
    {
      "pattern": "KD2",
      "reason": "All of its formulas are tier C (computed from the herbs: a strong herb, a high bitter-cold share, or a formula outside the first set), which a release does not show. A release shows its diet, points and lifestyle and the result page says so; whether another formula should serve it is the pharmacy and clinical reviewers' decision (design §8)."
    },
    {
      "pattern": "QB1",
      "reason": "All of its formulas are tier B (computed from the herbs: a high blood-activating share or an interaction flag), which a release does not show. A release shows its diet, points and lifestyle and the result page says so; whether another formula should serve it is the pharmacy and clinical reviewers' decision (design §8)."
    },
    {
      "pattern": "QB2",
      "reason": "All of its formulas are tier B (computed from the herbs: a high blood-activating share or an interaction flag), which a release does not show. A release shows its diet, points and lifestyle and the result page says so; whether another formula should serve it is the pharmacy and clinical reviewers' decision (design §8)."
    }
  ],
  "original": [
    "EX1",
    "EX2",
    "EX3",
    "EX4",
    "SP1",
    "SP2",
    "SP3",
    "SP4",
    "SP5",
    "SP6",
    "LV1",
    "LV2",
    "LV3",
    "LV4",
    "HT1",
    "HT2",
    "HT3",
    "LG1",
    "LG2",
    "KD1",
    "KD2",
    "QB1",
    "QB2"
  ],
  "red_flag_boundary": [],
  "textbook_sources": [],
  "waivers": [
    {
      "patterns": [
        "EX1",
        "EX2",
        "EX3",
        "EX4",
        "SP1",
        "SP2",
        "SP3",
        "SP4",
        "SP5",
        "SP6",
        "LV1",
        "LV2",
        "LV3",
        "LV4",
        "HT1",
        "HT2",
        "HT3",
        "LG1",
        "LG2",
        "KD1",
        "KD2",
        "QB1",
        "QB2"
      ],
      "reason": "The original library was written from the SOP and its quotations. No textbook or modern source is recorded for any pattern, and some patterns have no quotation of their own. Naming and checking a second source per pattern is a finding for the clinical reviewer (review pack: Citations), recorded here so that the gap can only shrink.",
      "row": "A2"
    },
    {
      "patterns": [
        "EX3",
        "HT2",
        "KD1",
        "SP6"
      ],
      "reason": "These four cannot reach the 40-point band from the inquiry alone (they are declared in needs_exam). Their golden seeds are the inquiry's answers only, derived mechanically from the question bank, and include no tongue or pulse finding. Golden cases are left as they are until the seed derivation learns to answer the examination screens.",
      "row": "A7"
    },
    {
      "patterns": [
        "HT1"
      ],
      "reason": "Its only tier-A formula, F_GUIPI (Gui Pi Tang), is partially verified (K-14): the source text lists eight herbs and the app the common ten-herb form. The pharmacy reviewer decides which form to keep.",
      "row": "A8"
    },
    {
      "patterns": [
        "EX1",
        "EX2",
        "EX3",
        "EX4",
        "SP1",
        "SP2",
        "SP3",
        "SP4",
        "SP5",
        "SP6",
        "LV1",
        "LV2",
        "LV3",
        "LV4",
        "HT1",
        "HT2",
        "HT3",
        "LG1",
        "LG2",
        "KD1",
        "KD2",
        "QB1",
        "QB2"
      ],
      "reason": "The red-flag boundary of a pattern was never recorded as data. The assessment shows the notice for every red flag whatever the pattern, but the physician has not listed which flags must stand in front of which pattern. The dossier lists the flags nearby for the reviewer.",
      "row": "A10"
    },
    {
      "patterns": [
        "EX1",
        "EX2",
        "EX3",
        "EX4",
        "SP2",
        "SP3",
        "SP4",
        "SP5",
        "SP6",
        "LV1",
        "LV2",
        "LV3",
        "LV4",
        "HT1",
        "HT2",
        "HT3",
        "LG1",
        "LG2",
        "KD1",
        "KD2",
        "QB1",
        "QB2"
      ],
      "reason": "The safety vignettes replay the typical patient of one pattern (SP1) and a few of others, and only SP1's include a red flag and a population gate. A vignette with a red flag and one gated by a population are required of every pattern admitted from now on.",
      "row": "A11"
    }
  ]
}
